{
  "name": "comms",
  "version-string": "3.1.2",
  "description": "COMMS is the C++(11) headers only, platform independent library, which makes the implementation of a communication protocol to be an easy and relatively quick process.",
  "homepage": "https://commschamp.github.io/",
  "documentation": "https://github.com/commschamp/comms_champion"
}
